### ISSUE TITLE
SSL/TLS seems not to work

### ISSUE THREAD

**Issue by alfredballe** [redis/hiredis#703]
I've created a ticket in Stack Overflow:https://stackoverflow.com/questions/57662058/hiredis-fails-with-tls

When running the example-ssl.c example, it seems not to respond to SSL/TLS.

It keeps failing with:

```
Couldn't initialize SSL!
Error:

```
Wireshark shows:
```
1027  26.554662 192.168.20.228 → 179.11.21.99 TCP 64 55480 → 30642 [SYN] Seq=0 Win=65535 Len=0 MSS=1460 WS=64 TSval=197044507 TSecr=0 SACK_PERM=1
 1028  26.589376 179.11.21.99 → 192.168.20.228 TCP 60 30642 → 55480 [SYN, ACK] Seq=0 Ack=1 Win=28560 Len=0 MSS=1440 SACK_PERM=1 TSval=136342937 TSecr=197044507 WS=512
 1029  26.589430 192.168.20.228 → 179.11.21.99 TCP 52 55480 → 30642 [ACK] Seq=1 Ack=1 Win=131328 Len=0 TSval=197044541 TSecr=136342937
 1030  26.589625 192.168.20.228 → 179.11.21.99 TCP 52 55480 → 30642 [FIN, ACK] Seq=1 Ack=1 Win=131328 Len=0 TSval=197044541 TSecr=136342937
 1033  26.625423 179.11.21.99 → 192.168.20.228 TCP 52 30642 → 55480 [FIN, ACK] Seq=1 Ack=2 Win=28672 Len=0 TSval=136342946 TSecr=197044541
 1034  26.625499 192.168.20.228 → 179.11.21.99 TCP 52 55480 → 30642 [ACK] Seq=2 Ack=2 Win=131328 Len=0 TSval=197044577 TSecr=136342946
```

Where as other clients shows:
```
902034 1181.706157 192.168.20.228 → 179.11.21.99 TCP 64 56765 → 30642 [SYN] Seq=0 Win=65535 Len=0 MSS=1460 WS=64 TSval=198187591 TSecr=0 SACK_PERM=1
902035 1181.742757 179.11.21.99 → 192.168.20.228 TCP 60 30642 → 56765 [SYN, ACK] Seq=0 Ack=1 Win=28560 Len=0 MSS=1440 SACK_PERM=1 TSval=106784830 TSecr=198187591 WS=512
902036 1181.742823 192.168.20.228 → 179.11.21.99 TCP 52 56765 → 30642 [ACK] Seq=1 Ack=1 Win=131328 Len=0 TSval=198187627 TSecr=106784830
902037 1181.744130 192.168.20.228 → 179.11.21.99 TLSv1 272 Client Hello
902039 1181.779023 179.11.21.99 → 192.168.20.228 TLSv1.2 1480 Server Hello
902040 1181.779026 179.11.21.99 → 192.168.20.228 TLSv1.2 912 Certificate, Server Key Exchange, Server Hello Done

```

**Comment by yossigo** [comment]
@alfredballe Also replied on SO with more details, looks like your hiredis is compiled without SSL support.

**Comment by alfredballe** [comment]
Thank you. Works.
